{
  "schema_version": 1,
  "dependency": "Wasmtime minimal C API",
  "version": "v45.0.0",
  "platform": "Win64",
  "release_url": "https://github.com/bytecodealliance/wasmtime/releases/tag/v45.0.0",
  "archive": {
    "name": "wasmtime-v45.0.0-x86_64-windows-c-api.zip",
    "url": "https://github.com/bytecodealliance/wasmtime/releases/download/v45.0.0/wasmtime-v45.0.0-x86_64-windows-c-api.zip",
    "size_bytes": 28820070,
    "sha256": "d5ee516fc141576ccd6c43146aafee1074c3c26764cba73b3a97f599a3791f9c",
    "root": "wasmtime-v45.0.0-x86_64-windows-c-api"
  },
  "layout": {
    "include_relative_path": "min/include",
    "dll_relative_path": "min/lib/wasmtime.dll",
    "import_library_relative_path": "min/lib/wasmtime.dll.lib",
    "license_relative_path": "LICENSE"
  },
  "install": {
    "relative_path": "Source/ThirdParty/Wasmtime/installed/Win64/v45.0.0",
    "managed_marker_name": ".avidscript-wasmtime-managed.json"
  },
  "license": {
    "expression": "Apache-2.0 WITH LLVM-exception",
    "tracked_file": "Source/ThirdParty/Wasmtime/LICENSE.txt"
  }
}
